{
  "$schema": "https://elabora.studio/schemas/0.1.2/screen.schema.json",
  "id": "compare",
  "title": "Two ways to do it",
  "covers": [
    "ITEM-4"
  ],
  "blocks": [
    {
      "id": "compare-row",
      "type": "columns",
      "style": "compare",
      "width": "wide",
      "props": {
        "count": 2,
        "widths": "equal"
      },
      "blocks": [
        {
          "id": "compare-a-title",
          "type": "heading",
          "slot": "first",
          "props": {
            "text": "The usual way",
            "level": 2
          }
        },
        {
          "id": "compare-a-list",
          "type": "text",
          "slot": "first",
          "props": {
            "markdown": "- A first habit, described in a few words\n- A second habit and what it costs\n- A third habit that seems faster"
          }
        },
        {
          "id": "compare-b-title",
          "type": "heading",
          "slot": "second",
          "props": {
            "text": "The recommended way",
            "level": 2
          }
        },
        {
          "id": "compare-b-list",
          "type": "text",
          "slot": "second",
          "props": {
            "markdown": "- The first change, described in a few words\n- The second change and what it brings\n- The third change, and why it is safer"
          }
        }
      ]
    }
  ]
}
