{
  "$schema": "https://elabora.studio/schemas/0.1.7/screen.schema.json",
  "id": "recap",
  "title": "What to remember",
  "covers": [
    "ITEM-6"
  ],
  "blocks": [
    {
      "id": "recap-list",
      "type": "text",
      "style": "checklist",
      "props": {
        "markdown": "- **The key rule.** One sentence that restates it in plain words.\n- **The procedure.** Four steps, always in the same order: notice, check, act, report.\n- **The first action.** When in doubt, apply the rule first and ask afterwards.\n- **Where to get help.** The team or the page to contact, in a few words."
      }
    }
  ]
}
